{
  "format": "mc3",
  "version": "0.3",
  "model": "urban-windows",
  "unit": "meter",
  "coordinateSystem": "right_handed_y_up",
  "rotationUnits": "degrees",
  "eulerOrder": "XYZ",
  "library": {
    "namespace": "urban-windows",
    "version": "1.0.0",
    "hash": "sha256:f31bafafe3336328c6465c2e417125c6d3c2b5e41da74fb1f7431f267bd9bc59"
  },
  "definitions": [
    {
      "id": "window.residential.double.classic_01",
      "object": {
        "type": "group",
        "id": "window.residential.double.classic_01",
        "name": "window.residential.double.classic_01",
        "transform": {
          "position": [
            0.0,
            0.0,
            0.0
          ],
          "rotation": [
            0.0,
            0.0,
            0.0
          ],
          "scale": [
            1.0,
            1.0,
            1.0
          ],
          "pivot": [
            0.0,
            0.0,
            0.0
          ]
        },
        "assetMetadata": {
          "category": "window",
          "subcategory": "residential_double",
          "styleTags": [
            "central_europe"
          ],
          "nominalSize": [
            1.2000000476837158,
            1.0,
            0.10000000149011612
          ],
          "bounds": {
            "min": [
              -0.6000000238418579,
              0.0,
              -0.05000000074505806
            ],
            "max": [
              0.6000000238418579,
              1.0,
              0.05000000074505806
            ]
          },
          "facing": "-Z",
          "collisionProxy": "none",
          "lods": {
            "low": "window.residential.double.classic_01.lod_low"
          },
          "shadowPolicy": "cast_receive",
          "license": "MIT",
          "provenance": "MeshWorld procedural (R112, build_mc3lib_content.cpp)",
          "sourceGeneratorOrHash": "cpp.mc3lib.urban_core.v1",
          "semanticVersion": "1.0.0"
        },
        "children": [
          {
            "type": "box",
            "name": "frame",
            "transform": {
              "position": [
                0.0,
                0.5,
                0.0
              ],
              "rotation": [
                0.0,
                0.0,
                0.0
              ],
              "scale": [
                1.0,
                1.0,
                1.0
              ],
              "pivot": [
                0.0,
                0.0,
                0.0
              ]
            },
            "material": "wood_window_frame",
            "primitive": {
              "primitiveType": "box",
              "size": [
                1.2000000476837158,
                1.0,
                0.10000000149011612
              ],
              "radius": 0.5,
              "height": 1.0,
              "segments": 32,
              "axis": "y",
              "majorRadius": 0.3499999940395355,
              "minorRadius": 0.15000000596046448,
              "subdivisionsX": 4,
              "subdivisionsZ": 4
            }
          },
          {
            "type": "box",
            "name": "glass",
            "transform": {
              "position": [
                0.0,
                0.5,
                0.009999999776482582
              ],
              "rotation": [
                0.0,
                0.0,
                0.0
              ],
              "scale": [
                1.0,
                1.0,
                1.0
              ],
              "pivot": [
                0.0,
                0.0,
                0.0
              ]
            },
            "material": "glass_clear",
            "primitive": {
              "primitiveType": "box",
              "size": [
                1.0399999618530273,
                0.8399999737739563,
                0.029999999329447746
              ],
              "radius": 0.5,
              "height": 1.0,
              "segments": 32,
              "axis": "y",
              "majorRadius": 0.3499999940395355,
              "minorRadius": 0.15000000596046448,
              "subdivisionsX": 4,
              "subdivisionsZ": 4
            }
          },
          {
            "type": "box",
            "name": "mullion_v",
            "transform": {
              "position": [
                0.0,
                0.5,
                0.019999999552965164
              ],
              "rotation": [
                0.0,
                0.0,
                0.0
              ],
              "scale": [
                1.0,
                1.0,
                1.0
              ],
              "pivot": [
                0.0,
                0.0,
                0.0
              ]
            },
            "material": "wood_window_frame",
            "primitive": {
              "primitiveType": "box",
              "size": [
                0.03999999910593033,
                0.8399999737739563,
                0.05000000074505806
              ],
              "radius": 0.5,
              "height": 1.0,
              "segments": 32,
              "axis": "y",
              "majorRadius": 0.3499999940395355,
              "minorRadius": 0.15000000596046448,
              "subdivisionsX": 4,
              "subdivisionsZ": 4
            }
          },
          {
            "type": "box",
            "name": "mullion_h",
            "transform": {
              "position": [
                0.0,
                0.5199999809265137,
                0.019999999552965164
              ],
              "rotation": [
                0.0,
                0.0,
                0.0
              ],
              "scale": [
                1.0,
                1.0,
                1.0
              ],
              "pivot": [
                0.0,
                0.0,
                0.0
              ]
            },
            "material": "wood_window_frame",
            "primitive": {
              "primitiveType": "box",
              "size": [
                1.0399999618530273,
                0.03999999910593033,
                0.05000000074505806
              ],
              "radius": 0.5,
              "height": 1.0,
              "segments": 32,
              "axis": "y",
              "majorRadius": 0.3499999940395355,
              "minorRadius": 0.15000000596046448,
              "subdivisionsX": 4,
              "subdivisionsZ": 4
            }
          }
        ]
      }
    },
    {
      "id": "window.residential.double.classic_01.lod_low",
      "object": {
        "type": "box",
        "id": "window.residential.double.classic_01.lod_low",
        "name": "proxy",
        "transform": {
          "position": [
            0.0,
            0.5,
            0.0
          ],
          "rotation": [
            0.0,
            0.0,
            0.0
          ],
          "scale": [
            1.0,
            1.0,
            1.0
          ],
          "pivot": [
            0.0,
            0.0,
            0.0
          ]
        },
        "material": "wood_window_frame",
        "primitive": {
          "primitiveType": "box",
          "size": [
            1.2000000476837158,
            1.0,
            0.10000000149011612
          ],
          "radius": 0.5,
          "height": 1.0,
          "segments": 32,
          "axis": "y",
          "majorRadius": 0.3499999940395355,
          "minorRadius": 0.15000000596046448,
          "subdivisionsX": 4,
          "subdivisionsZ": 4
        }
      }
    },
    {
      "id": "window.residential.double.classic_02",
      "object": {
        "type": "group",
        "id": "window.residential.double.classic_02",
        "name": "window.residential.double.classic_02",
        "transform": {
          "position": [
            0.0,
            0.0,
            0.0
          ],
          "rotation": [
            0.0,
            0.0,
            0.0
          ],
          "scale": [
            1.0,
            1.0,
            1.0
          ],
          "pivot": [
            0.0,
            0.0,
            0.0
          ]
        },
        "assetMetadata": {
          "category": "window",
          "subcategory": "residential_double",
          "styleTags": [
            "central_europe"
          ],
          "nominalSize": [
            1.909999966621399,
            1.0,
            0.10000000149011612
          ],
          "bounds": {
            "min": [
              -0.9549999833106995,
              0.0,
              -0.05000000074505806
            ],
            "max": [
              0.9549999833106995,
              1.0,
              0.05000000074505806
            ]
          },
          "facing": "-Z",
          "collisionProxy": "none",
          "lods": {
            "low": "window.residential.double.classic_02.lod_low"
          },
          "shadowPolicy": "cast_receive",
          "license": "MIT",
          "provenance": "MeshWorld procedural (R112, build_mc3lib_content.cpp)",
          "sourceGeneratorOrHash": "cpp.mc3lib.urban_core.v1",
          "semanticVersion": "1.0.0"
        },
        "children": [
          {
            "type": "box",
            "name": "frame",
            "transform": {
              "position": [
                0.0,
                0.5,
                0.0
              ],
              "rotation": [
                0.0,
                0.0,
                0.0
              ],
              "scale": [
                1.0,
                1.0,
                1.0
              ],
              "pivot": [
                0.0,
                0.0,
                0.0
              ]
            },
            "material": "wood_window_frame",
            "primitive": {
              "primitiveType": "box",
              "size": [
                1.2000000476837158,
                1.0,
                0.10000000149011612
              ],
              "radius": 0.5,
              "height": 1.0,
              "segments": 32,
              "axis": "y",